{
  "contract_id": "dc_example_delivery_contract",
  "schema_version": "1.0",
  "status": "scoped",
  "project_id": "example-project",
  "delivery": {
    "change_type": "governance",
    "target_line": "develop",
    "target_version": "v1.0.0",
    "affected_flow": "example delivery contract adoption",
    "gate": "L2"
  },
  "product_contract": {
    "outcome": "A governed change is bounded, verified, and independently reviewed before completion.",
    "acceptance_steps": [
      "The approved change produces the requested result."
    ],
    "non_goals": [
      "This contract does not replace project-specific CI, release, or business rules."
    ]
  },
  "truth_owner": "Project-owned delivery rules and the authoritative runtime/data paths named by the task.",
  "scope": {
    "write_allowlist": [
      "src/example/**",
      "tests/example/**",
      "docs/changes/example/**"
    ],
    "forbidden_paths": [
      "database/production/**"
    ],
    "out_of_scope": [
      "Unrelated refactors and changes outside the approved capability."
    ],
    "destructive_classification": "none",
    "rollback_or_recovery": "Revert the scoped commit through the project-approved recovery process."
  },
  "test_strategy": {
    "mode": "red_green",
    "public_seam": "Example public command or API behavior",
    "rationale": "The behavior is testable at a public contract seam.",
    "focused_test_command": "npm test -- example-contract"
  },
  "evidence_plan": {
    "final_proofs": [
      {
        "proof_id": "proof_example_runtime",
        "claim": "The scoped behavior works through its real entrypoint.",
        "command_or_check": "Run the project-owned focused test and runtime check.",
        "must_run_after_final_change": true
      }
    ]
  },
  "reviews": {
    "standards_truth": {
      "status": "pending",
      "evidence": "Awaiting scoped diff and authoritative-path review."
    },
    "product_spec": {
      "status": "pending",
      "evidence": "Awaiting product acceptance replay against the stated non-goals."
    }
  },
  "implementer": "agent-delivery-owner",
  "owner_confirmation": "not_required",
  "created_at": "2026-08-21T00:00:00Z",
  "updated_at": "2026-08-21T00:00:00Z"
}
